{
  "$schema": "https://json-schema.org/draft/2020-12/schema",
  "$id": "contracts/ai-egress/v1/egress-decision-request.schema.json",
  "title": "egress-decision-request",
  "description": "Metadata-only input to the OMES AI data-classification and model-egress policy evaluator (issue #214, ADR-0029, docs/ai-data-privacy-and-model-security.md). This shape MUST NEVER carry prompt text, response text, embeddings, retrieved documents, or a real credential/secret value - only bounded classification/destination/posture metadata used to reach a deterministic allow/deny/approval_required decision. `contains_authentication_material` is a caller-asserted boolean flag (never the material itself); it is intentionally not named with a banned secret-like substring so it can hold a plain boolean rather than being forced through the secret_ref shape.",
  "type": "object",
  "required": [
    "policy_version",
    "classification",
    "destination",
    "purpose",
    "provider_posture",
    "contains_authentication_material"
  ],
  "additionalProperties": false,
  "properties": {
    "policy_version": {
      "type": "string",
      "description": "The egress-policy contract version this request was authored against. An evaluator that does not recognize this version must fail closed (deny) rather than guess at semantics.",
      "pattern": "^[A-Za-z0-9_.-]{1,32}$"
    },
    "classification": {
      "type": "string",
      "description": "Data classification of the content that would be sent, per docs/ai-data-privacy-and-model-security.md section 4. Classification is about content/processing risk, not the filename or storage location.",
      "enum": ["PUBLIC", "INTERNAL", "CONFIDENTIAL", "RESTRICTED"]
    },
    "destination": {
      "type": "string",
      "description": "The model-destination class the content would be sent to, per docs/ai-data-privacy-and-model-security.md section 5.",
      "enum": ["local_only", "private_endpoint", "cloud_sanitized", "deny"]
    },
    "purpose": {
      "type": "string",
      "description": "A short, closed label for why model processing is requested (e.g. code_generation, reasoning_assist, summarization). Free-form prose describing the actual content is out of scope - this is a label, not a prompt.",
      "pattern": "^[a-z][a-z0-9_]{1,63}$"
    },
    "tenant_id": {
      "type": "string",
      "description": "Optional tenant scope for a multi-tenant caller (e.g. Control Center). Metadata only.",
      "pattern": "^[A-Za-z0-9_.:-]{1,128}$"
    },
    "resource_scope": {
      "type": "string",
      "description": "Optional resource scope within the tenant. Metadata only.",
      "pattern": "^[A-Za-z0-9_.:-]{1,128}$"
    },
    "provider_posture": {
      "type": "object",
      "description": "The pre-assessed posture of the destination provider/endpoint. `status` must be resolved to approved/not_approved for any non-local_only destination; `unknown` (or an absent object) fails closed.",
      "required": ["status"],
      "additionalProperties": false,
      "properties": {
        "status": {
          "type": "string",
          "enum": ["approved", "not_approved", "unknown"]
        },
        "provider_id": {
          "type": "string",
          "description": "An opaque provider/profile identifier - never a credential.",
          "pattern": "^[A-Za-z0-9_.:-]{1,128}$"
        }
      }
    },
    "contains_authentication_material": {
      "type": "boolean",
      "description": "True if the content the caller wants to send includes credentials, API tokens, private keys, or other authentication/secret material. This flag is caller-asserted; the evaluator never inspects content to derive it. Only an explicit `false` is treated as 'no authentication material' - the evaluator treats any other value as `true` (fail closed)."
    },
    "sanitization_evidence": {
      "type": "object",
      "description": "Evidence that application-owned sanitization/minimization occurred, referenced by identifier only - never the sanitized content itself.",
      "required": ["method", "evidence_id"],
      "additionalProperties": false,
      "properties": {
        "method": {
          "type": "string",
          "enum": ["tokenization", "redaction", "aggregation", "synthetic_data", "field_removal"]
        },
        "evidence_id": {
          "type": "string",
          "pattern": "^[A-Za-z0-9_.:-]{1,128}$"
        }
      }
    },
    "provider_assurance": {
      "type": "object",
      "description": "Provider-assurance evidence for the destination provider (issue #237, threat AI-07): the 10-item due-diligence checklist from docs/ai-data-privacy-and-model-security.md section 5, recorded as bounded verification statuses plus opaque, non-secret evidence references only - never a raw provider response or contract text. The evaluator (lib/omes/py/privacy/egress_policy.py) requires this object, with every item other than `private_networking_zero_retention_options` at status `verified`, before it will approve (allow/approval_required) a `cloud_sanitized` destination; a missing or incomplete record fails closed to `deny`. This shape mirrors contracts/ai-egress/v1/provider-assurance-evidence.schema.json - duplicated rather than `$ref`'d because this validator subset does not support `$ref` - and the two must be kept in sync by hand.",
      "required": ["schema_version", "provider_id", "assessed_at", "items"],
      "additionalProperties": false,
      "properties": {
        "schema_version": {
          "type": "string",
          "enum": ["v1"]
        },
        "provider_id": {
          "type": "string",
          "description": "An opaque provider/profile identifier - never a credential. Must match the corresponding `provider_posture.provider_id`.",
          "pattern": "^[A-Za-z0-9_.:-]{1,128}$"
        },
        "assessed_at": {
          "type": "string",
          "pattern": "^[0-9]{4}-[0-9]{2}-[0-9]{2}T[0-9]{2}:[0-9]{2}:[0-9]{2}Z$"
        },
        "assessment_reference": {
          "type": "string",
          "pattern": "^[A-Za-z0-9_.:-]{1,128}$"
        },
        "items": {
          "type": "object",
          "required": [
            "data_categories_and_purpose",
            "controller_processor_roles",
            "retention_and_deletion",
            "training_use",
            "abuse_monitoring_human_access",
            "subprocessors_and_transfer_locations",
            "encryption_and_tenant_isolation",
            "contractual_dpa_terms",
            "incident_notification_and_audit",
            "private_networking_zero_retention_options"
          ],
          "additionalProperties": false,
          "properties": {
            "data_categories_and_purpose": {
              "type": "object",
              "required": ["status"],
              "additionalProperties": false,
              "properties": {
                "status": {"type": "string", "enum": ["verified", "not_verified", "unknown", "not_applicable"]},
                "evidence_ref": {"type": "string", "pattern": "^[A-Za-z0-9_.:-]{1,128}$"}
              }
            },
            "controller_processor_roles": {
              "type": "object",
              "required": ["status"],
              "additionalProperties": false,
              "properties": {
                "status": {"type": "string", "enum": ["verified", "not_verified", "unknown", "not_applicable"]},
                "evidence_ref": {"type": "string", "pattern": "^[A-Za-z0-9_.:-]{1,128}$"}
              }
            },
            "retention_and_deletion": {
              "type": "object",
              "required": ["status"],
              "additionalProperties": false,
              "properties": {
                "status": {"type": "string", "enum": ["verified", "not_verified", "unknown", "not_applicable"]},
                "evidence_ref": {"type": "string", "pattern": "^[A-Za-z0-9_.:-]{1,128}$"}
              }
            },
            "training_use": {
              "type": "object",
              "required": ["status"],
              "additionalProperties": false,
              "properties": {
                "status": {"type": "string", "enum": ["verified", "not_verified", "unknown", "not_applicable"]},
                "evidence_ref": {"type": "string", "pattern": "^[A-Za-z0-9_.:-]{1,128}$"}
              }
            },
            "abuse_monitoring_human_access": {
              "type": "object",
              "required": ["status"],
              "additionalProperties": false,
              "properties": {
                "status": {"type": "string", "enum": ["verified", "not_verified", "unknown", "not_applicable"]},
                "evidence_ref": {"type": "string", "pattern": "^[A-Za-z0-9_.:-]{1,128}$"}
              }
            },
            "subprocessors_and_transfer_locations": {
              "type": "object",
              "required": ["status"],
              "additionalProperties": false,
              "properties": {
                "status": {"type": "string", "enum": ["verified", "not_verified", "unknown", "not_applicable"]},
                "evidence_ref": {"type": "string", "pattern": "^[A-Za-z0-9_.:-]{1,128}$"}
              }
            },
            "encryption_and_tenant_isolation": {
              "type": "object",
              "required": ["status"],
              "additionalProperties": false,
              "properties": {
                "status": {"type": "string", "enum": ["verified", "not_verified", "unknown", "not_applicable"]},
                "evidence_ref": {"type": "string", "pattern": "^[A-Za-z0-9_.:-]{1,128}$"}
              }
            },
            "contractual_dpa_terms": {
              "type": "object",
              "required": ["status"],
              "additionalProperties": false,
              "properties": {
                "status": {"type": "string", "enum": ["verified", "not_verified", "unknown", "not_applicable"]},
                "evidence_ref": {"type": "string", "pattern": "^[A-Za-z0-9_.:-]{1,128}$"}
              }
            },
            "incident_notification_and_audit": {
              "type": "object",
              "required": ["status"],
              "additionalProperties": false,
              "properties": {
                "status": {"type": "string", "enum": ["verified", "not_verified", "unknown", "not_applicable"]},
                "evidence_ref": {"type": "string", "pattern": "^[A-Za-z0-9_.:-]{1,128}$"}
              }
            },
            "private_networking_zero_retention_options": {
              "type": "object",
              "required": ["status"],
              "additionalProperties": false,
              "properties": {
                "status": {"type": "string", "enum": ["verified", "not_verified", "unknown", "not_applicable"]},
                "evidence_ref": {"type": "string", "pattern": "^[A-Za-z0-9_.:-]{1,128}$"}
              }
            }
          }
        }
      }
    }
  }
}
