{
  "policy_version": "v1",
  "classification": "CONFIDENTIAL",
  "destination": "cloud_sanitized",
  "purpose": "summarization",
  "resource_scope": "server-fixture-001",
  "provider_posture": {
    "status": "approved",
    "provider_id": "approved-cloud-provider-fixture"
  },
  "contains_authentication_material": false,
  "sanitization_evidence": {
    "method": "tokenization",
    "evidence_id": "sanitization-evidence-fixture-001"
  }
}
